name,desc:en,desc:nl,desc:de,desc:fr,desc:es,desc:eo,desc:ru
Tringa ochropus,"Dark brown sandpiper with a snowy white belly; in flight looks black above with boldly contrasting white rump. Bobs tail when nervous, but not habitually like Common Sandpiper. Often climbs steeply when flushed and flies quickly with deep wingbeats, swooping around a little like a swallow. Breeds in clearings and marshes in wet forest and woodland; migrants occur in fresh and brackish wetland habitats, especially on muddy shores of lakes and small ponds. Mainly found as singles or small groups, not mixed with other species.



","Dark brown sandpiper with a snowy white belly; in flight looks black above with boldly contrasting white rump. Bobs tail when nervous, but not habitually like Common Sandpiper. Often climbs steeply when flushed and flies quickly with deep wingbeats, swooping around a little like a swallow. Breeds in clearings and marshes in wet forest and woodland; migrants occur in fresh and brackish wetland habitats, especially on muddy shores of lakes and small ponds. Mainly found as singles or small groups, not mixed with other species.



","Dunkelbrauner Strandläufer mit schneeweißem Bauch; im Flug Oberseite schwarz mit stark kontrastierendem, weißem Bürzel. Wippt mit Hinterkörper, wenn aufgeregt, aber nicht gewohnheitsmäßig wie Flussuferläufer. Wenn aufgeschreckt, fliegt steil auf und schnell ab mit starken Flügelschlägen, aber ein wenig herumschwirrend wie eine Schwalbe. Brütet in Lichtungen und Sümpfen in feuchten Forsten und Wäldern; am Zug in Feuchtgebieten mit Süß- wie auch Brackwasser, besonders an schlammigen Ufern von Seen und kleinen Teichen. In der Regel einzeln oder in kleinen Gruppen, nicht vergesellschaftet mit anderen Arten.

","Chevalier brun foncé à ventre blanc neige; en vol, semble noir dessus avec un croupion blanc très contrastant. Hoche la queue lorsqu’il est inquiet, mais moins constamment que le Chevalier guignette. Lorsqu’on le lève, monte parfois abruptement, vole rapidement avec des battements d’ailes accentués tout en décrivant des piqués un peu comme une hirondelle. Niche dans les clairières et les marais des forêts et des boisés humides; en migration, fréquente les habitats humides d’eau douce et saumâtre, surtout sur les rivages vaseux des lacs et des petits étangs. S’observe principalement seul ou en petits groupes et non en compagnie d’individus d’autres espèces.

","Especie común en paso e invernada. Nidifica en claros y prados de bosques húmedos en el norte de Europa y Rusia. Se encuentra en humedales de diversa tipo tanto de agua dulce como salobre, especialmente de lagos o pequeñas pozas con orillas fangosas. Aparece generalmente solitario o en pequeños grupos, pero nunca en bandos mixtos. Mueve la cola arriba y abajo cuando se alarma, pero no de manera tan habitual como el Common Sandpiper. Tiene el dorso oscuro con pecho blanco. En vuelo se aprecia el dorso y las alas oscuras que contrastan con el obispillo blanco. Cuando vuela, a menudo alza el vuelo rápidamente y vuela rápido con largos batidos de alas, bajando en picado no muy lejos.

","Dark brown sandpiper with a snowy white belly; in flight looks black above with boldly contrasting white rump. Bobs tail when nervous, but not habitually like Common Sandpiper. Often climbs steeply when flushed and flies quickly with deep wingbeats, swooping around a little like a swallow. Breeds in clearings and marshes in wet forest and woodland; migrants occur in fresh and brackish wetland habitats, especially on muddy shores of lakes and small ponds. Mainly found as singles or small groups, not mixed with other species.



","Темно-коричневый кулик, имеющий белоснежное брюхо. В полете выглядит черным сверху; замечается сильно контрастное белое надхвостье. Качает хвост, когда нервничает, но не привычным образом, как перевозчик. Когда взлетает, испугавшийся, часто набирает высоту быстро и летит глубокими ударами крыльев, меняя направление, как ласточка. Гнездится на полянах и болотах во влажных лесах; во время миграции встречается в пресных и солоноватых водно-болотных угодий, особенно на грязных берегах озер и небольших прудов. В основном встречается поодиночке или небольшими группами, не вместе с другими видами куликов.

"
Tringa totanus,"Stocky brown wader with bright red legs; compare with slenderer, far more gracile Spotted Redshank in juvenile and non-breeding plumage. Often rather wary, alerting other birds with its loud, fluty, whistled calls. Bobs tail when nervous, and then flies to show flashy white trailing edge to wings, white rump patch. Feeds in muddy shallows, probing and picking with its bill. Inhabits fresh and coastal wetlands; also breeds on moorland, usually near water.





","Stocky brown wader with bright red legs; compare with slenderer, far more gracile Spotted Redshank in juvenile and non-breeding plumage. Often rather wary, alerting other birds with its loud, fluty, whistled calls. Bobs tail when nervous, and then flies to show flashy white trailing edge to wings, white rump patch. Feeds in muddy shallows, probing and picking with its bill. Inhabits fresh and coastal wetlands; also breeds on moorland, usually near water.





","Stämmiger brauner Watvogel mit leuchtend roten Beinen; im Vergleich zu schlankerem, weitaus grazileren Dunklen Wasserläufer im Jugend- und Schlichtkleid. Oft eher vorsichtig, alarmiert andere Vögel mit lauten, flötenden, pfeifenden Rufen. Wippt mit Schwanz, wenn aufgeregt, und fliegt dann mit auffälliger weißer Hinterkante an den Flügeln, und weißem Bürzelfleck. Sucht nach Nahrung im schlammigen Flachwasser, stochert und pickt mit dem Schnabel. Bewohnt Süßwasser- und Küstenfeuchtgebiete; brütet auch auf Moorland, meist in Wassernähe.

","Échassier trapu, brun à pattes rouge vif; comparer avec le Chevalier arlequin en plumage juvénile et non nicheur, qui est plus mince et plus frêle. Souvent plutôt méfiant, alerte les autres oiseaux de ses cris sonores, flûtés et sifflés. Lorsqu’il est inquiet, hoche la queue, puis s’envole en découvrant le bord de fuite blanc très visible de ses ailes ainsi que son croupion blanc. Se nourrit dans les eaux peu profondes boueuses en sondant et en picorant avec son bec. Habite les zones humides côtières et d’eau douce; niche également dans les landes, généralement près de l’eau.

","Cría más bien hacia el norte de España, especialmente en humedales costeros y de agua dulce. Se alimenta en zonas fangosas con agua escasa. Es bastante robusto y con plumaje pardo-grisáceo y brillantes patas rojizas. A menudo bastante cauteloso, que puede alertar a otras especies con su sonoro y aflautado silbido. Balancea la cola cuando se alarma, y entonces vuela mostrando una franja blanca en el borde de las secundarias y el obispillo blanco.

","Stocky brown wader with bright red legs; compare with slenderer, far more gracile Spotted Redshank in juvenile and non-breeding plumage. Often rather wary, alerting other birds with its loud, fluty, whistled calls. Bobs tail when nervous, and then flies to show flashy white trailing edge to wings, white rump patch. Feeds in muddy shallows, probing and picking with its bill. Inhabits fresh and coastal wetlands; also breeds on moorland, usually near water.





","Коренастый коричневый кулик, имеющий ярко-красные ноги. Похож на молодые и негнездовые особи щеголя, но травник толще и менее элегантный. Часто довольно пугливый, предупреждая других птиц своими громкими свистящими криками. Качает хвост, когда беспокоится, а затем летит, показывая блестящие белые пятна по задним краям крыльев и на надхвостье. Питается в грязном мелководье, суя клюв в воду и собирая корм с поверхности. Населяет пресные и прибрежные водно-болотные угодья; также гнездится на вересковой пустоши, обычно около воды.

"
Chroicocephalus ridibundus,"Fairly small gull, common and widespread across Eurasia. All plumages have big white blaze on leading edge of wing. Breeding adult has dark brown (not black) hood, red bill and legs; nonbreeding and immature have dark ear spot on white head, dark tip to red bill. Juvenile has mottled brownish back, which molts to pale gray by winter. Can be found in essentially any wet habitat, from duck ponds and farm fields to wild wetlands and seacoasts. Locally occurs in flocks of hundreds, sometimes thousands. Rare but regular vagrant to North America, especially in the northeast, where usually seen singly among flocks of Bonaparte’s or Ring-billed Gulls. Compared to nonbreeding Bonaparte’s, note Black-headed’s red bill, dark red legs, and more extensive black in underwings.

","Fairly small gull, common and widespread across Eurasia. All plumages have big white blaze on leading edge of wing. Breeding adult has dark brown (not black) hood, red bill and legs; nonbreeding and immature have dark ear spot on white head, dark tip to red bill. Juvenile has mottled brownish back, which molts to pale gray by winter. Can be found in essentially any wet habitat, from duck ponds and farm fields to wild wetlands and seacoasts. Locally occurs in flocks of hundreds, sometimes thousands. Rare but regular vagrant to North America, especially in the northeast, where usually seen singly among flocks of Bonaparte’s or Ring-billed Gulls. Compared to nonbreeding Bonaparte’s, note Black-headed’s red bill, dark red legs, and more extensive black in underwings.

",Die gewöhnliche kleine,"La mouette la plus commune dans la plupart des régions, fréquente les étangs, les champs cultivés, les zones sauvages humides et les côtes maritimes; forme localement des troupes de centaines et même parfois de milliers d’individus. En tous les plumages, grande marque blanche sur le bord d’attaque de l’aile. Adulte nicheur, capuchon brun foncé (et non noir), bec et pattes rouges; adulte non nicheur et immature, tache foncée sur la joue, tête blanche et pointe du bec foncée. Juvénile, dos brunâtre tacheté devenant gris clair en hiver.

","Es la pequeña gaviota más común en la mayoría del territorio que ocupa, desde estanques de anátidas y explotaciones agrícolas hasta humedales naturales y el litoral costero; aparece puntualmente en bandos de cientos y a veces miles de individuos. En cualquier plumaje tiene una franja blanca en el borde anterior del ala. El adulto en plumaje nupcial luce una capucha marrón oscura (no negra) con el pico y las patas de color rojo. Fuera de la época de cría y los inmaduros tienen la cabeza blanca con con un punto oscuro en la mejilla, el pico con la punta oscura. Los jóvenes tienen el dorso pardusco moteado que muda a gris claro en invierno.

","Fairly small gull, common and widespread across Eurasia. All plumages have big white blaze on leading edge of wing. Breeding adult has dark brown (not black) hood, red bill and legs; nonbreeding and immature have dark ear spot on white head, dark tip to red bill. Juvenile has mottled brownish back, which molts to pale gray by winter. Can be found in essentially any wet habitat, from duck ponds and farm fields to wild wetlands and seacoasts. Locally occurs in flocks of hundreds, sometimes thousands. Rare but regular vagrant to North America, especially in the northeast, where usually seen singly among flocks of Bonaparte’s or Ring-billed Gulls. Compared to nonbreeding Bonaparte’s, note Black-headed’s red bill, dark red legs, and more extensive black in underwings.

","Самый многочисленная мелкая чайка в большинстве районов. Встречаестя в разнообразных местах обитаний, включая пруды в парках, сельскохозяйственные поля, дикие болота и побережья. Иногда собирается стаями размером несколько сотен или даже тысяч особей. В любое время года имеет заметный белый треугольник на передней кромке крыла. Взрослая птица в брачном наряде имеет темно-коричневую голову и красные клюв и ноги. Взрослая птица в негнездовой период и молодая птица имеют только темное пятно на белой щеке и темный кончик клюва. Особи младше четырех месяцев имеют пятнисто-коричневую спину, становящаяся бледно-серой зимой.

"
Ichthyaetus melanocephalus,"Slightly larger than Black-headed Gull, more similar to Mew Gull in size and shape but bill stouter. Adult is distinctive, the only small gull with snow-white wingtips; breeding plumage has black hood. Nonbreeding and immature have distinctive, dark horizontal face mask. Juvenile has mottled brownish back, which molts to pale gray by winter. Tends to be uncommon to locally fairly common; often found with flocks of Black-headed Gulls and Mew (Common) Gulls.



","Slightly larger than Black-headed Gull, more similar to Mew Gull in size and shape but bill stouter. Adult is distinctive, the only small gull with snow-white wingtips; breeding plumage has black hood. Nonbreeding and immature have distinctive, dark horizontal face mask. Juvenile has mottled brownish back, which molts to pale gray by winter. Tends to be uncommon to locally fairly common; often found with flocks of Black-headed Gulls and Mew (Common) Gulls.



","Etwas größer als Lachmöwe, in Größe und Gestalt der Sturmmöwe ähnlich, aber gedrungenerer Schnabel. Altvögel unverwechselbar, einzige Kleinmöwe mit schneeweißen Flügelspitzen; Prachtkleid mit schwarzer Kapuze. Schlichtkleid und Jungvögel mit markanter, dunkler horizontaler Gesichtsmaske. Jungvögel oberseits bräunlich gefleckt, mausern im Winter zu hellem Grau. Eher ungewöhnlich bis örtlich ziemlich häufig; oft in Scharen von Lach- und Sturmmöwen.

","Un peu plus grosse que la Mouette rieuse, ressemble davantage au Goéland cendré par sa taille et sa silhouette, mais bec plus épais. Adulte facile à reconnaître, la seule mouette de cette taille dont la pointe des ailes est d’un blanc immaculé; adulte nicheur, capuchon noir. Individu non nicheur et immature, masque horizontal sombre. Juvénile, dos brunâtre tacheté devenant gris clair en hiver. Généralement peu commune à localement assez commune; s’observe souvent dans les troupes de Mouettes rieuses et de Goélands cendrés.

","Es poco común por lo general pero puede ser localmente bastante común, a menudo se observa en bandos de Black-headed Gulls y Mew (Common) Gulls. Es ligeramente más grande que la Black-headed Gull, más parecida en tamaño y forma a la Mew Gull pero con el pico más robusto. El adulto es fácil de identificar por ser la única gaviota pequeña con la punta de las alas de color blanco níveo; en plumaje nupcial tiene una capucha negra. Fuera de la época reproductora y los inmaduros tienen una oscura máscara horizontal muy patente. Los jóvenes tienen el dorso moteado pardusco que muda a gris claro en invierno.

","Slightly larger than Black-headed Gull, more similar to Mew Gull in size and shape but bill stouter. Adult is distinctive, the only small gull with snow-white wingtips; breeding plumage has black hood. Nonbreeding and immature have distinctive, dark horizontal face mask. Juvenile has mottled brownish back, which molts to pale gray by winter. Tends to be uncommon to locally fairly common; often found with flocks of Black-headed Gulls and Mew (Common) Gulls.



","Чуть крупнее, чем озерная чайка; больше похожа на сизую чайку размером и формой, но клюв толще. Взрослая птица отличительная; единственная мелкая чайка, имеющая белоснежные кончики крыльев. В брачном наряде имеет черную голову. Взрослая птица в негнездовой период и молодая птица имеют отличительную темную горизонтальную маску на лице. Особи младше четырех месяцев имеют пятнисто-коричневую спину, становящаяся бледно-серой зимой. Этот вид встречается нечасто, но чаще в определенных местах. Часто собирается стаями вместе с озерной и сизой чайками.

"
Larus canus,"Small, dainty gull with rather long, slender wings and a rounded head. Breeding adults are white-headed with an unmarked yellow bill; nonbreeding adults have smudgy brown markings on the head and a faint dark marking near the tip of the bill. Note dark eye. Immatures are brownish, with black-tipped pink bills. Known as Common Gull in Europe. Variable across extensive range, sometimes considered multiple species. North American birds known as Mew Gull, Eurasian birds as Common Gull. Breeds in wetlands, meadows, and along rivers. Winters in any open wetland habitat, especially beaches or sheltered coastal waters. Most similar to Ring-billed Gull, but smaller and smaller-billed. Immatures are especially difficult but note Mew Gull is more uniformly brownish.

","Small, dainty gull with rather long, slender wings and a rounded head. Breeding adults are white-headed with an unmarked yellow bill; nonbreeding adults have smudgy brown markings on the head and a faint dark marking near the tip of the bill. Note dark eye. Immatures are brownish, with black-tipped pink bills. Known as Common Gull in Europe. Variable across extensive range, sometimes considered multiple species. North American birds known as Mew Gull, Eurasian birds as Common Gull. Breeds in wetlands, meadows, and along rivers. Winters in any open wetland habitat, especially beaches or sheltered coastal waters. Most similar to Ring-billed Gull, but smaller and smaller-billed. Immatures are especially difficult but note Mew Gull is more uniformly brownish.

","Kleine zierliche Möwe. Dunkeläugig, mit langen Flügeln und abgerundetem Kopf. Brütende Altvögel mit weißem Kopf und einfarbig gelbem Schnabel; nicht brütende Altvögel grau gestrichelt am Kopf und Schnabel matter. Jüngere Vögel bräunlich, mit rosa Schnäbeln mit schmalem, dunklem Ring an Spitze. Unterarten variieren; nordamerikanische 'brachyrhynchus' ist kleinste, russische 'kamtschatschensis' größte Unterart. Brütet in Feuchtgebieten, Wiesen und an Stränden; überwintert in Lebensräumen am Wasser und auf Feldern. Im Gegensatz zu anderen Möwen nicht so häufig in großen städtische Zentren.

","Plus petit et plus élancé que le Goéland à bec cerclé. Petit bec sans le large anneau foncé. Adulte en hiver, taches brunes floues étendues sur la nuque (pas de rayures).




 

","Más pequeño y más esbelto que Ring-billed Gull. Pico muy pequeño y sin el anillo oscuro ancho. En invierno, los adultos tienen manchas marrones extensas (no estrías) en la nuca. Principalmente avistado en estanques costeros y playas en los sitios de invernada a lo largo de la costa oeste de Estados Unidos. Anida en humedales en el bosque boreal.

","Small, dainty gull with rather long, slender wings and a rounded head. Breeding adults are white-headed with an unmarked yellow bill; nonbreeding adults have smudgy brown markings on the head and a faint dark marking near the tip of the bill. Note dark eye. Immatures are brownish, with black-tipped pink bills. Known as Common Gull in Europe. Variable across extensive range, sometimes considered multiple species. North American birds known as Mew Gull, Eurasian birds as Common Gull. Breeds in wetlands, meadows, and along rivers. Winters in any open wetland habitat, especially beaches or sheltered coastal waters. Most similar to Ring-billed Gull, but smaller and smaller-billed. Immatures are especially difficult but note Mew Gull is more uniformly brownish.

","Мелкая изящная чайка. В любое время года имеет темный глаз, округлую голову и длинные крылья. Взрослые птицы в брачном наряде имеют белые голова и клюв без отметин; в негнездовой период взрослые птицы имеют нечеткую темную окраску на голове и клюве. Молодые птицы коричневатые, имеющие розовые клювы с черными кончиками. Подвиды отличаются размером; Североамериканский подвид «brachyrhynchus» -- самый маленький, а дальневосточный подвид -- «kamtschatschensis» -- самый большой. Гнездится на болотах, лугах и пляжах; зимует в прибрежных местах обитания и на полях. Не так тесно привязан к крупным городским центрам, как некоторые другие чайки.

"
