name,desc:en,desc:nl,desc:de,desc:fr,desc:es,desc:eo,desc:ru
Regulus ignicapilla,"Fairly common to uncommon in mixed woodland, forest, plantations, gardens, usually with conifers. In autumn–winter, often travels with foraging flocks of tits and other small woodland birds. Inconspicuous but active, often high in the canopy. Smaller than warblers, with distinctive combination of boldly striped head, bronzy-golden patch on sides of neck. Male has fiery orange crown stripe; female's is yellow.

","Fairly common to uncommon in mixed woodland, forest, plantations, gardens, usually with conifers. In autumn–winter, often travels with foraging flocks of tits and other small woodland birds. Inconspicuous but active, often high in the canopy. Smaller than warblers, with distinctive combination of boldly striped head, bronzy-golden patch on sides of neck. Male has fiery orange crown stripe; female's is yellow.

","Ziemlich häufig bis selten in Mischwäldern, Forsten, Plantagen, Gärten, meist mit Nadelbäumen. Im Herbst bis Winter oft vergesellschaftet mit Scharen von Meisen und anderen kleinen Waldvögeln auf Nahrungssuche. Unauffällig, aber aktiv, oft hoch in Baumkronen. Kleiner als Grasmücken, mit kennzeichnender Kombination aus kräftig gestreiftem Kopf, und bronzegoldenem Fleck an Halsseite. Männchen mit leuchtend orangem Scheitelstreif; beim Weibchen gelb. 

 

","Assez commun à peu commun dans les boisés et les forêts mixtes, les plantations et les jardins, généralement avec des conifères. En automne et en hiver, se déplace et se nourrit souvent avec les troupes de mésanges et d’autres petits oiseaux des bois. Peu visible mais actif, souvent haut dans la voûte forestière. Plus petit que les fauvettes, combinaison distinctive de caractères, tête fortement rayée, tache dorée sur les côtés du cou. Rayure médiane de la couronne jaune-orange vif chez le mâle, jaune plus terne chez la femelle.

 

","Bastante común en unas zonas y algo menos común en otras siempre en bosques mixtos, zonas arboladas, plantaciones y jardines, generalmente con coníferas. En otoño-invierno a menudo viaja en bandos en búsqueda de alimentos de tits y otras aves pequeñas de bosque. Es discreto pero activo y frecuentemente está en las copas altas de los árboles. Más pequeño que warblers, tiene una inconfundible combinación de rayado visible en la cabeza y mancha bronceada-dorada en los lados del cuello. El macho tiene franja intensa naranja en el píleo mientras que la de la hembra es amarilla.

","Fairly common to uncommon in mixed woodland, forest, plantations, gardens, usually with conifers. In autumn–winter, often travels with foraging flocks of tits and other small woodland birds. Inconspicuous but active, often high in the canopy. Smaller than warblers, with distinctive combination of boldly striped head, bronzy-golden patch on sides of neck. Male has fiery orange crown stripe; female's is yellow.

","Спорадично многочисленная птица в смешанных лесах, плантациях и садах, обычно с хвойными деревьями. Осенью и зимой часто присоединяется к смешанным стаям синиц и различных видов птиц. Незаметный, но активный, часто высоко в пологе леса. Крошечная птица, мельче пеночки, с отличительным сочетанием поразительно полосатой головы и бронзово-золотого пятна по бокам шеи. У самца огненно-оранжевая полоса на темени; у самки полоса желтая.

"
Sitta europaea,"Fairly common in deciduous and mixed woodland, forest, gardens with larger trees; visits bird feeders. Usually seen as singles or pairs, hitching along trunks and larger branches. Acts a bit like a mini-woodpecker, but does not use its tail for support and sometimes goes downwards head-first. Often feeds in the canopy, but also feeds on the ground where seeds have fallen. Easily overlooked until rather loud ringing calls are learned. Appearance distinctive, with long pointed bill, short tail, black mask, and peachy-colored underparts.

","Fairly common in deciduous and mixed woodland, forest, gardens with larger trees; visits bird feeders. Usually seen as singles or pairs, hitching along trunks and larger branches. Acts a bit like a mini-woodpecker, but does not use its tail for support and sometimes goes downwards head-first. Often feeds in the canopy, but also feeds on the ground where seeds have fallen. Easily overlooked until rather loud ringing calls are learned. Appearance distinctive, with long pointed bill, short tail, black mask, and peachy-colored underparts.

","Ziemlich häufig in Laub- und Mischwäldern, Forsten, Gärten mit größeren Bäumen; besucht Vogelfutterstellen. In der Regel einzeln oder in Paaren, klettert entlang Stämmen und größeren Ästen. Verhält sich ein wenig wie Mini-Specht, benutzt aber Schwanz nicht als Stütze und klettert manchmal kopfüber nach unten. Frisst oft im Kronendach, aber auch herabgefallene Samen am Boden. Leicht zu übersehen, außer man kennt seine pfeifenden Rufe. Aussehen unverwechselbar, mit langem spitzem Schnabel, kurzem Schwanz, schwarzem Augenstreif und pfirsichfarbener Unterseite.

","Assez commune dans les boisés et les forêts de feuillus et mixtes ainsi que les jardins avec de grands arbres; visite les mangeoires. S’observe habituellement isolée ou en couple, grimpe le long des troncs et des grosses branches. Se comporte comme un pic en miniature, mais ne prend pas appui sur sa queue et descend parfois la tête en bas. Se nourrit souvent dans la voûte forestière, mais mange également les graines tombées au sol. Passe souvent inaperçue à moins qu’on reconnaisse ses cris carillonnants assez sonores Se reconnaît facilement, long bec pointu, queue courte, masque noir et dessous tirant plus ou moins sur le fauve.

","Bastante común en bosque caducifolio y mixto, montes, jardines con árboles más grandes. Visita comederos de pájaros. Por lo general se observan ejemplares aislados o en parejas encaramados a lo largo de troncos y ramas más grandes. Actúa como un pequeño pájaro carpintero, pero no usa su cola para sostenerse y a menudo camina cabeza abajo. Suele alimentarse cerca del dosel de los árboles, pero también se alimenta en el suelo donde han caído las semillas. Puede pasar inadvertido hasta que se escuchan los reclamos de contacto bastante fuertes. Aspecto característico por su pico largo y puntiagudo, cola corta, máscara negra y partes inferiores de color anaranjado.

","Fairly common in deciduous and mixed woodland, forest, gardens with larger trees; visits bird feeders. Usually seen as singles or pairs, hitching along trunks and larger branches. Acts a bit like a mini-woodpecker, but does not use its tail for support and sometimes goes downwards head-first. Often feeds in the canopy, but also feeds on the ground where seeds have fallen. Easily overlooked until rather loud ringing calls are learned. Appearance distinctive, with long pointed bill, short tail, black mask, and peachy-colored underparts.

","Довольно многочисленная птица, обитающая в лиственных и смешанных лесах и садах с большими деревьями; посещает кормушки. Обычно встречается поодиночке или парами, цепляющийся за стволы и более крупные ветви. Ведет себя немного как крошечный дятел, но не использует свой хвост для поддержки и иногда лезет по стволам вниз головой. Часто питается в кроне деревьев, но также и на земле, где упали семена. Часто не замечается, пока не издает громкие позвывки. Внешне отличителен, имеющий длинный остроконечный клюв, короткий хвост, черуню «маску» и брюхо персикового цвета.

"
Certhia familiaris,"Fairly common but inconspicuous (plumage blends well with bark) in woods, forests, and gardens with larger trees. Usually seen as singles or pairs, creeping along trunks and branches using its tail for support, like a mini-woodpecker. Probes in crevices for insects and spiders, and often spirals up then drops to low on the next tree and spirals up again. In areas where Short-toed Treecreeper also occurs, the two species are often not safely distinguished without considerable experience.

","Fairly common but inconspicuous (plumage blends well with bark) in woods, forests, and gardens with larger trees. Usually seen as singles or pairs, creeping along trunks and branches using its tail for support, like a mini-woodpecker. Probes in crevices for insects and spiders, and often spirals up then drops to low on the next tree and spirals up again. In areas where Short-toed Treecreeper also occurs, the two species are often not safely distinguished without considerable experience.

","Ziemlich häufig, aber unauffällig (Gefieder gut an Baumrinde angepaßt) in Wäldern, Forsten und Gärten mit größeren Bäumen. In der Regel einzeln oder in Paaren, kriecht an Stämmen und Ästen entlang und benutzt Schwanz als Stütze, wie ein Mini-Specht. Sucht in Spalten nach Insekten und Spinnennahrung; klettert oft spiralförmig nach oben, fliegt dann tief zum nächsten Baum und spiralförmig wieder nach oben. Im gemeinsamen Verbreitungsgebiet mit Gartenbaumäufer, oft ohne große Erfahrung nicht sicher von diesem zu unterscheiden.

 

","Assez commun mais discret (le plumage se fond bien avec la couleur de l’écorce), fréquente les bois, les forêts et les jardins avec de grands arbres. S’observe habituellement seul ou en couple, grimpe le long des troncs et des branches en prenant appui sur sa queue comme un pic en miniature. Explore les crevasses à la recherche d’insectes et d’araignées, monte souvent en spirale, puis redescend vers le bas d’un autre arbre pour monter de nouveau en spirale. Dans les régions où le Grimpereau des jardins est également présent, il est souvent impossible de distinguer les deux espèces avec certitude à moins d’avoir une expérience considérable.

","Bastante común pero discreto (el plumaje se mimetiza bien con la corteza de los árboles) en montes, bosques y jardines con árboles más grandes. Por lo general se ven individuos o parejas escalando los troncos y las ramas usando su cola como soporte, como un pequeño pájaro carpintero. Explora las grietas de los árboles en busca de insectos y arañas, a menudo ascendiendo en forma de espiral por un árbol, para luego dejarse caer a la base del árbol más próximo para volver a ascender. En áreas donde también hay Short-toed Treecreeper, es muy difícil distinguir las dos especies con seguridad sin una considerable experiencia.

","Fairly common but inconspicuous (plumage blends well with bark) in woods, forests, and gardens with larger trees. Usually seen as singles or pairs, creeping along trunks and branches using its tail for support, like a mini-woodpecker. Probes in crevices for insects and spiders, and often spirals up then drops to low on the next tree and spirals up again. In areas where Short-toed Treecreeper also occurs, the two species are often not safely distinguished without considerable experience.

","Довольно многочисленная, но незаметная птица; оперение хороши сливается с корой деревьев. Обитает в лесах и садах с большими деревьями. Обычно встречается поодиночке или парами, ползя по стволам и ветвям, используя хвост для поддержки, как крошечный дятел. Клювом ищет насекомых и пауков в расщелинах коры деревьев. Часто поднимается по стволу спиральным путем, затем перелетает вниз на следующее дерево и по-прежнему поднимается. В районах, где также встречается короткопалая пищуха, эти два вида часто невозможно различить без значительного опыта.

"
Certhia brachydactyla,"Difficult to separate from Eurasian Treecreeper: note slightly longer bill, shorter hind claw, browner flanks, and even steps on the wingbar. In the field best separated by voice, a penetrating ","Difficult to separate from Eurasian Treecreeper: note slightly longer bill, shorter hind claw, browner flanks, and even steps on the wingbar. In the field best separated by voice, a penetrating ","Schwierig vom Waldbaumläufer zu unterscheiden: etwas längerer Schnabel, kürzere Hinterkralle, braunere Flanken und gleichmäßig gestuftes Flügelfeld. Im Feld am besten anhand Gesang zu unterscheiden, ein durchdringendes ","Difficile à distinguer du Grimpereau des bois : remarquer le bec légèrement plus long, l’ongle postérieur plus court, les flancs plus bruns et les gradations égales sur la barre alaire. Sur le terrain, la voix est le meilleur critère d’identification, un tît pénétrant. Là où son aire de distribution recoupe celle du Grimpereau des bois, s’observe plutôt dans les boisés de feuillus, à plus basse altitude, sur les terres agricoles et dans les parcs.

","Difícil de separar del Eurasian Treecreeper, aunque tiene pico un poco más largo, uña posterior más corta, flancos más marrones y escalones uniformes en la franja alar. En el campo se identifican mejor por la voz, un ","Difficult to separate from Eurasian Treecreeper: note slightly longer bill, shorter hind claw, browner flanks, and even steps on the wingbar. In the field best separated by voice, a penetrating ","Этот вид трудно отличить от обыкновенной пищухи; обратите внимание на немного более длинный клюв, более короткий коготь на заднем пальце, более коричневую окраску по бокам, и ровный рисунок «ступенек» в охристой полоске на крыле. Где ареал перекрывается с ареалом обыкновенной пищухи, короткопалая обычно встречается в более лиственных лесах на более низких высотах, а также в сельскохозяйственных угодьях и парках.

"
Troglodytes troglodytes,"Common but visually inconspicuous in wooded habitats with dense understory, gardens, hedges in farmland, heathland, coastal cliffs. Often sings from a fairly exposed perch, but at other times rather mouselike, creeping in brambles and understory. Identified fairly easily by tiny size, overall brown plumage, and habit of holding tail cocked. Heard much more than seen: song is loud and ebullient, a varied series of trills and ringing warbles, repeated.

","Common but visually inconspicuous in wooded habitats with dense understory, gardens, hedges in farmland, heathland, coastal cliffs. Often sings from a fairly exposed perch, but at other times rather mouselike, creeping in brambles and understory. Identified fairly easily by tiny size, overall brown plumage, and habit of holding tail cocked. Heard much more than seen: song is loud and ebullient, a varied series of trills and ringing warbles, repeated.

","Häufig, aber optisch unauffällig in bewaldeten Lebensräumen mit dichtem Unterholz, Gärten, Hecken auf Agrarflächen, Heide, Küstenklippen. Singt oft von ziemlich exponierter Warte, kriecht aber sonst eher mausartig im Brombeergestrüpp und Unterholz. Ziemlich leicht anhand  winziger Größe zu erkennen, insgesamt braunem Gefieder und gewohnheitsmäßig steil aufgerichtetem Schwanz. Viel öfter zu hören als zu sehen: Gesang laut und schmetternd, eine abwechslungsreiche, anhaltende Abfolge von Trillern und Pfeiftönen.

    

 

","Commun mais peu visible dans les bois à sous-étage dense, les jardins, les haies des terres agricoles, les landes et les falaises côtières. Chante parfois sur un perchoir assez exposé, mais sinon se comporte plutôt comme une souris, grimpe dans les ronces et la végétation basse. Assez facile à identifier par sa taille minuscule, son plumage brun et son habitude de tenir la queue relevée. On l’entend beaucoup plus souvent qu’on le voit : chant fort et exubérant, série variée de trilles et de gazouillis sonores répétés.

","Común pero discreto en hábitats arbolados con sotobosque denso, jardines, setos en tierras de cultivo, brezales y acantilados costeros. Suele cantar desde un posadero bastante expuesto, pero en otras ocasiones se comporta como un ratón, moviéndose entre las zarzas y el sotobosque. Se identifica con bastante facilidad por el tamaño pequeño, el plumaje marrón, y el hábito de mantener la cola elevada. Se escucha más frecuentemente de lo que se ve. El canto es potente y animado con una serie diversa de trinos y gorjeos que se repiten.

","Common but visually inconspicuous in wooded habitats with dense understory, gardens, hedges in farmland, heathland, coastal cliffs. Often sings from a fairly exposed perch, but at other times rather mouselike, creeping in brambles and understory. Identified fairly easily by tiny size, overall brown plumage, and habit of holding tail cocked. Heard much more than seen: song is loud and ebullient, a varied series of trills and ringing warbles, repeated.

","Многочисленная, но визуально незаметная птица, обитающая в лесистых местах обитания с густым подлеском, в садах, лесополосах на сельскохозяйственных угодьях, в пустошах и около прибрежных скалов. Часто поет, сидя в довольно видном месте, но в других случаях скорее похож на мышь, ползающий в кустарнике и подлеске. Довольно легко распознается по крошечному размеру, общему коричневому оперению и привычке держать хвост приподнятым. Слышится гораздо больше, чем видится: песня громкая и бодрая, высокое разнообразное сочетание трелей и быстрых мелодичных нот.

"
Sturnus vulgaris,"Stocky and dark overall. Short tail, triangular wings, and long, pointed bill. Close look reveals beautiful plumage. In breeding season, shows purple and green iridescence on body with yellow bill. In winter, bold white spots cover the entire body. Native to Eurasia; introduced in many regions worldwide, where it is now abundant. Often in large flocks. Makes variety of squeaky vocalizations, including proficient mimicry of other species. Inhabits a wide range of open habitats, often in very close proximity to people. Visits feeders, and is often aggressive.

","Stocky and dark overall. Short tail, triangular wings, and long, pointed bill. Close look reveals beautiful plumage. In breeding season, shows purple and green iridescence on body with yellow bill. In winter, bold white spots cover the entire body. Native to Eurasia; introduced in many regions worldwide, where it is now abundant. Often in large flocks. Makes variety of squeaky vocalizations, including proficient mimicry of other species. Inhabits a wide range of open habitats, often in very close proximity to people. Visits feeders, and is often aggressive.

","Gedrungener und dunkler Gesamteindruck. Kurzer Schwanz, dreieckige Flügel und langer, spitzer Schnabel. Bei genauem Hinsehen hübsches Gefieder. Während Brutzeit violetter und grüner Gefiederglanz mit gelbem Schnabel. Im Winter mit kräftigen weißen Flecken am ganzen Körper. Heimisch in Europa; eingeführt in Nordamerika und anderen Regionen weltweit, wo er stark verbreitet ist. Oft in großen Scharen. Gesang abwechslungsreiches Gezwitscher; ahmt andere Arten nach. Besucht Vogelfutterhäuschen, ist oft angriffslustig.

 

","Trapu en entièrement foncé. Queue courte, ailes triangulaires et long bec pointu. De près, on découvre la beauté du plumage. Pendant la saison de nidification, corps à reflets violets et verts, bec jaune. En hiver, corps entièrement couvert de taches blanches bien nettes. Originaire d’Europe; introduit en Amérique du Nord et dans d’autres régions du monde où il est maintenant abondant. Souvent en grandes troupes. Émet divers cris grinçants, imite d’autres espèces. Visite les mangeoires, souvent agressif.




 

","Rechoncho y mayormente oscuro. Cola corta, alas triangulares, pico largo y puntiagudo. Una mirada cercana revela su hermoso plumaje. En época de reproducción, muestra púrpura y verde iridiscente en el cuerpo, y tiene el pico amarillo. En invierno, manchas blancas contrastantes cubren todo el cuerpo. Nativo de Europa; introducido a Norteamérica y otras regiones en todo el mundo, donde ahora es abundante. A menudo en grandes bandadas. Emite una variedad de vocalizaciones chirriantes e imita a otras especies. Visita los comederos, y a menudo es agresivo.

","Stocky and dark overall. Short tail, triangular wings, and long, pointed bill. Close look reveals beautiful plumage. In breeding season, shows purple and green iridescence on body with yellow bill. In winter, bold white spots cover the entire body. Native to Eurasia; introduced in many regions worldwide, where it is now abundant. Often in large flocks. Makes variety of squeaky vocalizations, including proficient mimicry of other species. Inhabits a wide range of open habitats, often in very close proximity to people. Visits feeders, and is often aggressive.

","Коренастый и вообще темная птица, имеющая короткий хвост, треугольные крылья и длинный остроконечный клюв. При внимательном рассмотрении раскрывается красивое оперение. В брачном наряде оперение имеет пурпурно-зеленый металлический отлив; клюв желтый. Зимой заметные белые пятна покрывают все тело. Родом из Евразии; интродуцированный вид в Северной Америке и других регионах по всему миру, где сейчас является одной из самых многочисленных птиц. Часто собирается большими стаями. Издает большое разнообразие скрипучих звуков и заимствований голосов других птиц. Посещает кормушки и часто агрессивен.

"
